,product_names,sale_price,actual_price
0,Beme Ripper Gaming Earphones,1499.0,2200.0
1,Lenovo HE05 Neckband Bluetooth,1499.0,1999.0
2,Multifunctional Zoom Flashlight With Currency Checker,1599.0,1599.0
3,AYRing Temperature Affect Color Changing Mood Ring,449.0,999.0
4,X8 Ultra Smartwatch 49MM with Bluetooth Calling,7999.0,11999.0
5,Blulory Glifo Smart Watch series 7,5599.0,5599.0
6,Gionee Handsfree (Original),599.0,599.0
7,Audionic Airbud 2 Max,2899.0,4200.0
8,BEME Explorer 22.5W 10000mAH PowerBank,7999.0,7999.0
9,BEME Explorer Mini 22.5W 5000mAh PowerBank,3999.0,6999.0
10,Air Max LCD Display Transparent Earbuds,2999.0,4000.0
11,Orafit Mega Smart Watch,4999.0,4999.0
12,Transparent Wireless + Bluetooth Dual-Mode Rechargeable Mouse,1499.0,2000.0
13,Lenovo LP10 True Wireless Headphones with ENC,4999.0,6999.0
14,HiWatch Pro T900 Ultra 2 Smart Watch,1999.0,2999.0
15,Audionic Elite E5 Mobile Speaker,2900.0,4500.0
16,Xcess Pulse I Smart Watch,3999.0,17999.0
17,"Tiktok,Instagram Bluetooth Remote For Android Phones",1499.0,1700.0
18,BEME Buds Pro 2 Max,5999.0,8500.0
19,BEME Explorer PowerBank 2 Max 22.5W 20000mAh with iPhone 15 Supported Chip,6499.0,12000.0
20,HryFine Smart Bracelet,800.0,2999.0
21,BEME Hush ANC Wireless Headphones,4999.0,8000.0
22,Magnetic Charging Cable - Braided LED Charging Cable,399.0,399.0
23,Haylou GT1 Bluetooth 5.0 Sports HD Stereo Touch Control Ear Buds,5199.0,5199.0
24,AKEKIO AE08 Stereo Handsfree,299.0,499.0
25,"Oraimo Roll Earbuds OEB-03D 365 Day Warranty,IPX4 Water Resistenece, Touch Controls",3175.0,3175.0
26,BEME Explorer PowerBank 2 22.5W 10000mAh with iPhone 15 Supported Chip,4499.0,8000.0
27,"Camera Detector Anti-peep detector compact and portable, USB infrared anti-monitoring",1999.0,1999.0
28,Bluedi Ambient Sensor LED Night Light With Smart Auto ON / Off,599.0,599.0
29,YOLO Fortuner Calling Smart Watch with 1 Year Warranty,7400.0,8999.0
30,Rgb magnetic charging cable,599.0,599.0
31,BEME Elite Buds Voice Changing Earbuds with ENC,4999.0,8000.0
32,SUP Game Box 400 In 1 Retro Handheld Game Console,2100.0,4999.0
33,Audionic Supreme X10 NeckBand,4399.0,4399.0
34,M15 Video Game Stick 4K 64G 20000+ Retro Games,5499.0,6000.0
35,4 in 1 Folding Ballpoint Pen,479.0,560.0
36,Motion Sensor Light Wireless LED Night Light,800.0,800.0
37,BEME Explorer Transparent TWS Speaker,3999.0,5999.0
38,"Mibro T1 Smart Watch with AMOLED Display, Bluetooth Calling (1 Month Warranty)",12999.0,15999.0
39,Ship Humidifier,699.0,899.0
40,Kieslect Smart Calling Watch Kr 6 Months Warranty,12499.0,13999.0
41,Earphone/ Headphone 3.5mm Audio Splitter/ Divider (connects two handsfree at same time),157.0,157.0
42,Xiaomi Mibro Air Smart Watch,4999.0,6499.0
43,INTELLIGENT INDUCTION BACK PROTECTOR,1699.0,1699.0
44,Xiaomi Mi True Wireless Earbuds Basic 2【2020】,3599.0,3999.0
45,Wire Cable Rotatable Storage Box and Mobile Phone Holder Portable Round,299.0,800.0
46,Tire Pressure Gauge Keychain with Display Count,999.0,1130.0
47,Aspor A351 2IN1 iPhone & Type-C Flexible Portable Mini 5000mAh Power Bank,2499.0,3000.0
48,BEME NeckWave Voice Changer Wireless Neckband,4999.0,4999.0
49,Sony HF Ex15 In-ear handfree,1999.0,1999.0
50,Generic 18W Quick 3.0 Charger,499.0,499.0
51,4 in 1 Laser Pointer Screen Stylus Pen Ballpoint Pen,469.0,999.99
52,BEME Photon Buds Solar Powered,4499.0,6000.0
53,BEME NeckWave Pro Voice Changing Neckband With Dual Batteries,3999.0,4999.0
54,"E-Writing-Pad / Tablet, 8.5 inch Electronic Drawing Pads for Kids, Portable Reusable Erasable",1199.0,1199.0
55,Electric Portable Clothes Lint Pill Fluff Remover,499.0,700.0
56,Gyro Fidget Cube Sensory Infinity Cube Autism Relief Toys,410.0,650.0
57,BEME Turtle Dual Functionality Wireless Speaker and Earbuds,5999.0,9999.0
58,Adjustable Universal Plastic Phone Holder for Smartphones and Tablets,199.0,249.0
59,Magnetic Finger Rings Fidget Spinner Toy Anti-Stress Anxiety Relief,699.0,849.0
60,Magnetic self-rolling Tidy USB Cable with Connector Type C/Iphone/Android (White),399.0,399.0
61,Beads Bracelet Cable - Micro USB Android - iPhone - Type C - Charging + Data Cable,290.0,999.99
62,Haino Teko C8 Calling SmartWatch 3 Straps Version.,8999.0,14000.0
63,Portable USB Plug Night Light,239.0,590.0
64,Transparent ARC Electric Lighter USB Camping COB Light Rechargeable Waterproof,2599.0,2999.0
65,4 in 1 Extension and Charger 180 degree with 2 USB ports,999.0,1200.0
66,Boya BY-M1 Microphone,2499.0,2499.0
67,FT42 Ultra Smart Watch,8999.0,8999.0
68,Oraioo Colorful Silicone Non-Slip USB Mug Warmer,699.0,699.0
69,Usb to Type C Metal OTG Keychain,189.0,399.0
70,Lenovo Thinkplus CyberPunk,4999.0,7999.0
71,XCESS Pulse Ultra Smart Watch,4499.0,19999.0
72,UV Currency Checker Mini Light,150.0,499.99
73,5 in 1 Keyboard Cleaning Brush Kit Keycap Puller with Earbuds Cleaner,699.0,1500.0
74,Boost Pulse Wireless ANC Headset,5999.0,8999.0
75,"Multi-Function Emergency Hammer Flashlight With Power Bank, Window Breaker, Seat Belt Cutter",2149.0,2290.0
76,Mini Chair Mobile Phone Stand,149.0,690.0
77,Nia Q6 Bluetooth Wireless Headphone,3199.0,4999.0
78,Multifunctional Tool Card and Phone Holder,399.0,540.0
79,DIKI ORBIT BALL CUBE Stainless Steel Large,479.0,799.0
80,SK22 2 in 1 Smart Watch With Bluetooth Calling,8999.0,8999.0
81,Fishing Glow Sticks Rod Tip Glow Sticks,499.0,999.0
82,"GENERIC 20W USB-C Power Adapter for Apple iPhone 8 / 8 Plus, Apple iPhone SE 2020, Apple iPhone X / XS / XS Max, Apple iPhone 11 / 11 Pro / 11 Pro Max, Apple iPhone 12 Mini / 12 Pro / 12 Pro Max",1599.0,1999.0
83,Nano Gel Pad,399.0,399.0
84,K8 Wireless Microphone For Mobile Type-C & Lightning,1599.0,1599.0
85,Move Speed PD20W Mini Charger Type C,2499.0,3399.0
86,Speed-X SPE27-2 Dual Lens Night Vision Motion Detection Bulb Camera,4499.0,4999.0
87,SUP Retro Game Box Console Handheld Dual Controller 400 in 1 Games,3200.0,6000.0
88,Haylou RS4 Max Smartwatch  With Dual Straps,8999.0,10499.0
89,BEME Torch Multifunctional FlashLight,1699.0,2000.0
90,Xiaomi Pro 300Mbps Wireless Wifi Amplifier Extender Repeater,4799.0,4799.0
91,Audionic Studio 1 Earphones,699.0,699.0
92,Audionic Prime X Wired Handsfree,699.0,750.0
93,Creative Bracing Wire Luminous Toy Flywheel Flash Spinning Top Light-emitting Gyro Shining,249.0,249.0
94,Aluminum Foil Thicken Butyl Waterproof Tape Wall Crack Roof Duct Repair Adhesive Tape High Temperature Resistance Waterproof,599.0,599.0
95,Flexifire Laptop Foldable Plastic Non-slip Stand,999.0,2990.0
96,Mouse Pad For Gaming And Office Non Slip Rubber With Locking Edge Large (26cm X 21cm x 0.2cm),349.0,349.0
97,Mi Box S 4K HDR TV Box,10999.0,11999.0
98,180 Degree Rotational Speed charging and Data Cable,399.0,399.0
99,Electric Hand Warmer Self-Heating Cushion- MJ2050-HEJ,1299.0,2000.0
100,"D8S Kids Digital Camera – 1080P HD, 48MP, Front & Rear Dual Lens, Thermal Print",6699.0,7000.0
101,Magnetic Teeth Shape Table Organizer,99.0,99.0
102,Nano Mist Spary For Beauty and disinfection .,780.0,1499.0
103,Audionic Airbud Two,3200.0,4990.0
104,Cable Winder Cord Wrap Cord Organizer for Kitchen Appliances,149.0,200.0
105,Lightning to 3.5mm Headphone Jack Adapter,499.0,499.0
106,FlyNova Pro RGB Lights Flying Spinner,1699.0,1699.0
107,Space Pods Max Supreme Earphones (w Type-C Connector/Lightning Connector),1149.0,1199.0
108,Rose Crystal Diamond RGB Table Lamp,1999.0,1999.0
109,Blue Shark CH-5 Trigger Controller For Smartphones,349.0,699.99
110,Haylou Solar Pro Sport Smart Watch,10999.0,12499.0
111,Mini Portable Vacuum Cleaner Wireless Handheld,1499.0,1650.0
112,Portable Mini Rechargeable Desktop Spray Fan Water Drop Shape Misting Fan Personal Cooling Humidifier,1199.0,1650.0
113,Infinity Calling Smart Watch by Comet,7999.0,8999.0
114,Rakco Electric Car Heating & Cooling Fan,2299.0,2999.0
115,Belgium Mouse Glue Traps (Board),249.0,630.0
116,Magnus Smart Watch by Comet,6999.0,10999.0
117,Xiaomi Mi 37W Dual-Port Car Charger,2200.0,2799.0
118,Lenovo bullet gaming earphones Bluetooth V5.0 Wireless Earbuds Headphone HIFI Sound Quality Persistent Touch Control Earphone - Black,4699.0,4699.0
119,Wire organizer Clip,200.0,399.0
120,Magnet Wire Clamp P1,670.0,789.0
121,SPACE Mini External 10000mAh Power Bank MI-036,4099.0,4099.0
122,IR-FM01 Infrared Thermometer,1699.0,1699.0
123,OPPO Band Style,5500.0,9999.0
124,BEME NOMAD Boost Multifunction 10000mAh PowerBank,9999.0,14999.0
125,Dmax Phone Holder for Bathroom and Kitchen,690.0,1290.0
126,Joyroom 10000mAh 22.5W Ultra-Fast Charging Power Bank JR-QP191,3999.0,3999.0
127,Pepper Spray with Keychain,1490.0,1618.0
128,Space WC-130C Quick Charge 3.0 Wall Charger With Type-C Cable,1499.0,1499.0
129,Audionic SOLO X-9,2690.0,2690.0
130,Xcess XB81 Wireless Earbuds,2499.0,6999.0
131,Portable Folding Pedestal Fan Rechargeable,3799.0,3799.0
132,Wearable Personal Air Cooler Neck Fan,1499.0,1499.0
133,Luckarm Wireless Doorbell,1150.0,1150.0
134,Haino Teko T93 Ultra Max Smart Watch,9849.0,9849.0
135,M6 Wireless 4.2 Bluetooth Headset Sport Handsfree Stereo Earphone,499.0,499.0
136,Tripod Mount Holder 2 in 1 Universal Smartphone And Tablet + Phone . Mount Yunteng Ipad,699.0,849.0
137,Akekio AE23 Extra Bass Noise Isolating Wired Handsfree,549.0,749.0
138,Havit Gaming Headset HV-H2198d 6 Months Warranty,2600.0,3990.0
139,Ldnio 6 USB 3 Power Socket,1999.0,1999.0
140,Intelligent Automatic Sensor Foam Soap Dispenser Smart Induction Foam Dispenser Auto Liquid Soap Dispenser Touchless Hand Washer,2999.0,3299.0
141,Generic 18W Qualcomm 3.0 Quick Charger,649.0,649.0
142,Guardian Angel Self Protection,499.0,999.0
143,LDNIO Power Strip 2 Port with 2 USB and 1 USB-C PD & QC3.0 EU (SC2311)  ORIGINAL– White,2999.0,2999.0
144,Audionic MN-250 Earphone,459.0,459.0
145,Baseus Encok H17 3.5mm lateral in-Ear Wired Earphone White,2199.0,2199.0
146,Air 31 TWS Transparent Earbuds,1499.0,1499.0
147,Baseus Cafule PD 20W Metal Data Cable Type-C to iPhone,2199.0,2199.0
148,"Boya BY-M1DM Dual Lavalier Universal Microphone with a Single 1/8 Stereo Connector, 13ft Cable for Cameras and Smmartphones",4599.0,4599.0
149,Infinix XH01 - Wireless Bluetooth Cap - Blue,1999.0,1999.0
150,Mini Remote Control Car Watch Toys 2.4 GHz Wrist Racing Car Watch For Kids,2800.0,2800.0
151,Haino Teko G8 Max Golden Edition 45MM SmartWatch,8299.0,8299.0
152,Havit Wired Headphones H2238d 6 Months Warranty,2499.0,2700.0
153,Glock Toygun Soft Darts For Kids With 10 Soft Darts and 8 Shell,1599.0,1599.0
154,Audionic Thunder T-40 Earphone,479.0,479.0
155,YOLO PLAY YJP-201 Travel and Party Booster,1999.0,2150.0
156,Haylou G3 True Wireless Gaming Earbuds,8299.0,8600.0
157,Lenovo GM2 Pro Wireless Earbuds,2799.0,4000.0
158,K9 Wireless Microphone For Mobile Type-C & Lightning,1499.0,4000.0
159,Haylou RS4 Plus Smartwatch with AMOLED Display and IP68 Water Resistance,11999.0,13499.0
160,Blulory Magsafe Battery Pack Wireless Powerbank - 5000mAh,4999.0,4999.0
161,Xtrike Me MP-002 Gaming Mouse Pad Dragon Design,599.0,700.0
162,NIA X2 Bluetooth Wireless Headphone Grey & Withe,1490.0,1490.0
163,Space SG-545 Signature Earphone,630.0,630.0
164,Space WC-130 Quick Charge 3.0 Wall Charger With Micro-USB Cable,945.0,945.0
165,G-shape Multifunctional Lamp & Bluetooth Speaker With Wireless Charging,3499.0,3499.0
166,HK9 Pro Plus Smartwatch Dual Straps,7499.0,7499.0
167,Multi-Function Self Defense Tactical Pen With Emergency Led Light Whistle Glass Breaker Outdoor Survival,3499.0,3698.0
168,DOBE Mobile Clamp For PS5 Controller TP5-0527B,799.0,799.0
169,LDNIO A321 3.1A DUAL USB PORTS FAST CHARGE + MICRO USB CABLE  MOBILE CHARGER,950.0,999.0
170,Audionic Thunder T-50,480.0,500.0
171,BEME Transformer 65W Fast Charging Cable 5 in 1,1299.0,1700.0
172,Raptor RGB Mouse Pad,2199.0,2499.0
173,Baseus Encok C17 Type-C Earphone,2799.0,2799.0
174,Space ChargeSync Type-C To Type-C Cable CE-470,699.0,699.0
175,Sony WH-CH510 Wireless Headphones: Wireless Bluetooth On-Ear Headset with Mic,7999.0,7999.0
176,Gionee C-Type Handsfree,799.0,850.0
177,SUP Game Box 900 In 1 Retro Handheld Game Console,4199.0,4199.0
178,Boost Falcon TWS Earbuds,4000.0,6000.0
179,RGB LED SOFT RING LIGHT MJ26 26CM With Phone Holder Photography Fill Light Selfie Set,2499.0,5990.0
180,Aspor A350 50000mAh PowerBank 22.5w Fast Charging with LED,8599.0,9500.0
181,Space PD + Quick Charge 3.0 Wall Charger WC-136,1499.0,1499.0
182,Audionic Damac D-50,459.0,459.0
183,Havit Gaming Headphones H2032d 6 Months Warranty,2899.0,2899.0
184,Xiaomi Redmi Buds Essential,4999.0,4999.0
185,A9 Airpods Pro ANC/ENC Touch Screen Wireless Earbuds,3499.0,3999.0
186,Baseus Superior USB to Lightning 2.4A 1M Fast Charging Data Cable,1200.0,1500.0
187,Havit Speakers HV-SK473 6 Months Warranty,1299.0,1299.0
188,Audionic Thunder T-30 Earphone,449.0,449.0
189,"Rock Humidifier Fine Mist Colorful LED Lights Diffuser For Bedroom, Office, home",2249.0,2249.0
190,Baseus Tungsten Gold Type-C to iPhone PD 20W Fast Charging Data Cable,2499.0,2499.0
191,Havit Bluetooth Earphones E500BT 3 Months Warranty,2950.0,3140.0
192,Blulory Glifo G5,5799.0,5999.0
193,Havit Wired Headphone H202D 6 Months Warranty,1200.0,1200.0
194,Ldnio 6A Max Universal Plug,1399.0,1399.0
195,HUAWEI Band 9,16499.0,16499.0
196,Audionic S-80 Type C 2.1 Dual USB Port Charger,699.0,799.0
197,D10 MULTIMEDIA SPEAKER - USB 2.0,999.0,1199.0
198,Joyroom JR-CP1 Car Charger with Bluetooth Earphone Touch Sensor On Earbud v5.0,2599.0,2899.0
199,Space Charge-Sync Rope Lightning Cable CE-481,699.0,699.0
200,SPACE 20000mAh Power Bank PD + QC 3.0 SP-075,6499.0,6499.0
201,Ronin Smart Watch R-07,9995.0,18995.0
202,Blulory Glifo 8 Ultra Smartwatch,7599.0,7799.0
203,Mibro X1,9900.0,11499.0
204,Baseus Digital Display Type-C To iPhone 20W Fast Charging Data Cable,2999.0,2999.0
205,Haino Teko T92 Ultra Max with 2 Straps,8799.0,8999.0
206,Havit Wired Headphones H2262d 6 Months Warranty,2199.0,2199.0
207,Baseus GaN5 Fast Charger 20W With Type-C-to-iPhone Cable,3699.0,3699.0
208,Ronin fast charging Type C To IPhone Cable  R-909,799.0,1599.0
209,Havit Wired Headphones HV-H2178d 6 Months Warranty,1749.0,1900.0
210,Audionic Akasaki Mobile Speaker,1390.0,1390.0
211,4 in 1 Transparent Spice Jar Salt And Pepper Seasoning Bottle Kitchen Storage Container Accessories,649.0,649.0
212,ROCK W33 Portable Magnetic Magsafe Wireless Charger,2999.0,3420.0
213,Haino Teko RW-15 Smartwatch – Ceramic Gold,8599.0,9000.0
214,Havit RGB Speakers SK563  6 Months Warranty,2100.0,2300.0
215,Space True Wireless Earphones TW-20,2799.0,2999.0
216,"Audionic CLASSIC MASTI-85 (8"" SPEAKER)",6999.0,6999.0
217,"Space Quick Charge 3.0 WC-120s (Single Port) Qualcomm Quick Charge 3.0, 3.4A",999.0,999.0
218,Aspor A316 20000mAh Power Bank PD 22.5W Fast Charging Powerbank,4699.0,6000.0
219,Portable Mini Pocket Printer Thermal Printer with Thermal Printing Paper,5000.0,5000.0
220,Baseus Encok 3.5mm Wired Earphone H19 Black,1599.0,1599.0
221,Haino Teko Smart Watch RW-11,8999.0,8999.0
222,Havit Gaming Headset H2026d 6 Months Warranty,3499.0,3499.0
223,Evaporative Portable Air Cooler,2999.0,2999.0
224,Ronin R-06 Smart Watch,7995.0,15995.0
225,Lenovo Thinkplus Livepods LP12,4599.0,4599.0
226,Audionic Rome,1290.0,1290.0
227,Ronin ENC Gaming  Earbuds R-520,4699.0,7800.0
228,Ronin 3 in 1 Cable R-305,899.0,1599.0
229,Baseus GaN5 20W Fast Charger Mini 1C CN Amber Orange,3800.0,3800.0
230,Havit True Wireless Stereo Earbuds TW916 3 Months Warranty,3790.0,3790.0
231,Havit Speakers SK708 6 Months Warranty,1950.0,1950.0
232,Kieslect Lora Calling Watch,15499.0,15499.0
233,LDNIO Magical Box 6USB Port USB Charger with Mobile Power 2600 mAh (6 USB Adapter + Powerbank 2600 mAh),2699.0,2699.0
234,Audionic Sugar 8 With Torch,1849.0,1999.0
235,Flame Heater 900W Mini Portable Electric Fireplace Warmer,2999.0,2999.0
236,Boost Sonic Wireless Headset,3500.0,6000.0
237,Realme Buds Air 3,14500.0,14500.0
238,Havit Speakers SK800BT 6 Months Warranty,3399.0,3399.0
239,Dobe TP5-0504 Charging Dock For PS5 Controller,1299.0,1899.0
240,AUDIONIC MAX-101 2.1 HI-FI SPEAKER,3550.0,5150.0
241,Audionic COCO C7 Mobile Speaker,1199.0,1199.0
242,Audionic Lava,1690.0,1690.0
243,Audionic ROKO Portable Mobile Speaker,2199.0,2500.0
244,Boya BY-MM1 Microphone,4899.0,4899.0
245,BEME FlashVolt Transformer Car Charger Dual PD 66W With Smart Display,3199.0,4000.0
246,NIA J1 ANC Wireless Bluetooth Headphone,3499.0,3899.0
247,Gravity Sensor Gesture Control Stunt Racing Car,4999.0,4999.0
248,Boost Groove Wireless Headset,3000.0,5000.0
249,realme Buds Air 3S,10499.0,10499.0
250,Realme Buds Q2s,7599.0,7599.0
251,Eckert Coffee Cup Humidifier,1400.0,1400.0
252,TW8 Ultra Smart Watch,7799.0,7960.0
253,Havit Gaming Headphones HV-H2212d 6 Months Warranty,4400.0,4699.0
254,Lenovo He05x 2 Bluetooth 5.0 Earphones Hifi Magnetic Neckband Headset,1999.0,2300.0
255,Bluedio BT5 Wireless Headphone and Wired with Built-in Microphone,4499.0,5000.0
256,Official Samsung 25W Super Fast Charger Type-C 2 pins,3999.0,3999.0
257,Havit Gaming Headphones H659d 6 Months Warranty,4899.0,4899.0
258,Havit RGB Speakers SK208 6 Months Warranty,2849.0,2999.0
259,TW-18 Ultra Smart Watch,8200.0,8350.0
260,Baseus Bluetooth Single Ear Wireless Earphone A05,2845.0,2845.0
261,Kieslect Smart Tag Lite,6449.0,6700.0
262,Multi functional support universal Clipper /Holder,899.0,1499.0
263,Aspor A317 30000mAh PowerBank 22.5W PD 20W Fast Charging Built in Cable Portable,5599.0,6000.0
264,Infrared Ray Tracking Wall Climbing Car With Laser Gun,4149.0,4149.0
265,Ronin Crystal Clear Sound Android Handsfree  R-9,799.0,799.0
266,Baseus Encok W3 TWS Earphones Noise Reduction,7499.0,7499.0
267,Xtrike-Me RGB Gaming Headset with Noise Reduction Microphone GH-712,3750.0,4000.0
268,Pods Max Wireless Headphones,2999.0,2999.0
269,Aspor A382 Wireless Charging 10000mAh Power Bank Max 15W Fast Charging PD20W,4999.0,6000.0
270,CMF By Nothing Buds Pro 2 with Hybrid ANC,19999.0,19999.0
271,Ronin Earbuds R-740,3695.0,3695.0
272,Ronin  Magnetic Neckband R-870,2199.0,6299.0
273,Ronin 33W Type-C Fast Charger R-728,2399.0,4949.0
274,Ultrasonic Cool Mist Air Humidifier Purifier with LED Light N5,2499.0,2499.0
275,Baseus Type-C Male to 3.5mm Female Adapter,2199.0,2199.0
276,Baseus A2 Cordless Car Vacuum Cleaner 5000pa,11999.0,12499.0
277,KOSPET TANK T2 Smartwatch | Speacial Edition,17499.0,20500.0
278,Kieslect KS Calling Smart Watch,17499.0,17499.0
279,Realme Buds Air 3 Neo,9199.0,9199.0
280,Havit Gaming Headset HV-H2232d 6 Months Warranty,3200.0,3200.0
281,Havit RGB Speakers SK210Mini 6 Months Warranty,1799.0,1949.0
282,Havit RGB Speakers SK206 6 Months Warranty,1999.0,2299.0
283,Z59 Ultra Smart Watch,7499.0,7649.0
284,Audionic Solo X50,5999.0,9999.0
285,Audionic SUGAR 40 TOP-LOAD SPEAKER,4999.0,7499.0
286,"Speed-X 603PU Universal Power Strip – 3 AC Outlets, 4 USB & 1 Type-C Fast Charging",2699.0,3000.0
287,M90 Pro Earbuds LED Display Headset,2099.0,3000.0
288,HK10 Pro Max Smartwatch 2.02 Inches Large Screen 3D Visual Action,8500.0,9999.0
289,Ronin Neckband R-970,2299.0,4599.0
290,Havit RGB Speakers SK204 6 Months Warranty,2999.0,3249.0
291,Baseus Blade Series  20000mAh 100W Laptop Fast Charging Power Bank,23499.0,23999.0
292,Baseus Otaku Life Rotary Adjustment Lazy Holder (Applicable for iPhone/ iPad),6499.0,6499.0
293,Original Mi motion Activated Night Light 2,2899.0,2999.0
294,Joyroom 100W Type-C to Type-C Cable,1299.0,1299.0
295,Aspor A381 5000mAh 15W Magnetic Wireless Powerbank,4199.0,5500.0
296,S10 Ultra 2 Smartwatch 49MM with Bluetooth Calling,2499.0,2499.0
297,CMF by Nothing Watch Pro 2,22499.0,22499.0
298,Ronin Energy Saving Smart Micro USB Charger R-788,599.0,1199.0
299,Cat Humidifier Cute Aroma Diffuser with Night Light,1999.0,1999.0
300,Mini Wood Grain Usb Humidifier,2399.0,2500.0
301,Baseus Flash Series II 3 in 1 100W Charging Cable U+C to M+L+C,4999.0,4999.0
302,LENOVO MONSTER AIRMARS XKT08,6599.0,6599.0
303,MONSTER AIRMARS XKT02,4999.0,4999.0
304,Xiaomi Mi Band 7,12999.0,12999.0
305,Redmi Watch 2 Lite,14999.0,14999.0
306,Havit Gaming Headphones H2029U 6 Months Warranty,6499.0,6499.0
307,Havit RGB Speakers  SK201 6 Months Warranty,4400.0,4649.0
308,Baseus 20W 6000mAh Magnetic Wireless Charging PowerBank,6649.0,6649.0
309,Baseus Bipow Pro 20W Fast Charging 10000mAh Mobile Power Bank,6499.0,6499.0
310,Audionic Royal 7,8799.0,14600.0
311,Alfa Wireless N Adapter 150Mbps W102,699.0,900.0
312,Ronin Comfortable Wearing Earbuds R-475,3799.0,7599.0
313,Ronin ENC Gaming Earbuds R-460,4599.0,8999.0
314,Ronin ENC  & Gaming Earbuds R-175,4499.0,8799.0
315,Haylou GT1 2022 Earbuds,5499.0,5499.0
316,Baseus Super Si Pro Quick Charger Type C + USB 30W CN Black,5499.0,5499.0
317,Baseus Bowie P1x In-ear Neckband Wireless Earphones,6499.0,6499.0
318,Xiaomi Mi Band 7 Pro,21499.0,22500.0
319,Havit Wireless Charger W3001,3599.0,3600.0
320,Baseus Share Together PPS Multi-Port 120W 2U+2C Fast Charging Car Charger With Extension Cord,6499.0,6499.0
321,Space Charge-Sync Lightning Cable,399.0,399.0
322,i10 Mini Wireless + Bluetooth Air Mouse With Touchpad 7 Color Backlit Light 2.4Ghz,1599.0,2000.0
323,Faxite Y50 50000mah 22.5W Fast Charging Portable Power Bank With LED Light,9999.0,12000.0
324,Space Dual Port PD + Quick Charge 3.0 Wall Charger + Cable,2499.0,2499.0
325,Joyroom Type-C To Lightning 1.2M Fast Charging Cable,999.0,1300.0
326,ONIKUMA K19 Professional Gaming Headphone with RGB LED Backlight,3899.0,5000.0
327,Aspor A336 Powerbank 20000mAh 22.5W Fast Charging,4499.0,5000.0
328,Ronin PD 33W Dual Port Charger R-115,2520.0,5199.0
329,Ronin 10000mAh Power Bank R-83,3799.0,7399.0
330,Ronin Dual Port PD Charger R-628,2099.0,2099.0
331,Ronin 65W Turbo Charger Chairman Series Dual-Port R-315,2899.0,5799.0
332,Ronin R-011 LUXE Smart Watch,13499.0,23899.0
333,Vehicle Humidifier Breathing Lamp 260ML Fragrance Diffuser Rechargeable,3699.0,3699.0
334,Baseus Bowie M2s True Wireless Earbuds,17999.0,18499.0
335,Baseus Bowie EX True Wireless Earphones,20999.0,21499.0
336,Baseus Adaman Metal 20000mAh PowerBank 22.5W Fast Charging,9499.0,9499.0
337,Kieslect L11 Pro,11499.0,11499.0
338,REALME WATCH 2 PRO,14699.0,14699.0
339,Monster XKT10 Bluetooth Earphones,8499.0,8499.0
340,Havit RGB Bluetooth Speakers SK755 6 Months Warranty,4400.0,4699.0
341,Havit USB 2.0 Speakers SK717 6 Months Warranty,1799.0,2000.0
342,Havit Gaming Headphones H662d 6 Months Warranty,5999.0,6199.0
343,Havit  RGB Speakers SK205 6 Months Warranty,2999.0,3199.0
344,Havit RGB Speakers SK202 6 Months Warranty,2999.0,3299.0
345,Baseus Crystal Shine Series Data Cable Fast Charging USB to iPhone 2.4A 1.2m Sky Blue,1249.0,1249.0
346,"Baseus Foldable Sleeve Case MacBook - 13"" & 16""",3199.0,3199.0
347,Speed-X Technologies P9 Bluetooth Headset,2499.0,3300.0
348,Speed-X 6 In 1 Multiport Type C 4k HDMI USB 3.0 Converter,2299.0,2500.0
349,Joyroom Flash-Charge Series 3A Fast Charging Data Cable Lightning,899.0,1200.0
350,CMF Buds By Nothing with Active Noise Cancellation,14499.0,14499.0
351,Ronin 3 Port 33W Quick charger R-928,2999.0,6049.0
352,Ronin 2.4A Car Charger For iPhone R-545,799.0,1699.0
353,Ronin Infinite Power 30000mAh Power Bank R-204,7999.0,14949.0
354,Ronin 20W Type-C to C Wall Charger R-128,1999.0,1999.0
355,Ronin R-02 Smart Watch,9999.0,16499.0
356,Baseus Super Mini Inflator Pump,9499.0,10000.0
357,Baseus Adaman Metal 30W 20000mAh Digital Display Fast charge Power Bank,11999.0,11999.0
358,Moxom 3Meter  10 feet Lengthen Speed Cable- Android,799.0,799.0
359,BEME FlashVolt 2C Car Charger PD Fast Charging With Digital Display,1699.0,2500.0
360,Kisonli Rgb Speaker Alarm Clock Bluetooth 5.0 Tf-Card For Mobile LP-2s,2799.0,3500.0
361,"Speed-X 504PU Premium Portable Power Strip – 5 Sockets, 2 USB & 2 Type-C",2699.0,3000.0
362,SPEED-X 3-in-1 Type-C 3.1 to OTG + HDMI + USB 3.0 Adapter,1199.0,1500.0
363,"Speed-X 303PUC Premium Portable Power Strip – 3 Sockets, 3 USB Ports & 1 Type-C Port",2150.0,2500.0
364,Xtrike-Me Wired RGB Gaming Headset with Static Lighting Effects GH-515W,3199.0,3700.0
365,Smart Box X96Q Mini Quad Core 2G+16G 4K 60FPS ANDROID 10V,5499.0,6500.0
366,Ronin Qualcomm Quick Car Charger Type-C R-911,1049.0,2199.0
367,Ronin 5 in 1 Smart wireless Charger R-733,3399.0,6699.0
368,Ronin R-01 Smart Watch,8999.0,14499.0
369,Ronin Wolve Wireless Headphone R-4400,3999.0,3999.0
370,Ronin 20W Dual-Port QC & PD Fast Car Charger R-345,1499.0,2949.0
371,Ronin Neckband R-270,3699.0,7399.0
372,Ronin R-04 Smart Watch,9599.0,15999.0
373,Ronin R-03 Smart Watch,6599.0,13999.0
374,Ronin R-012 LUXE Smart Watch,10999.0,21499.0
375,Baseus_Cleaning_Pen_NGBS000002,1999.0,1999.0
376,Baseus Bowie H2 Noise-Cancelling Wireless Headphone Grey,29999.0,29999.0
377,Baseus Bowie D05 Wireless Headphones Grey,12499.0,12499.0
378,Baseus PowerCombo 65W Digital PowerStrip 3AC+1U+1C+Retractable-C with 1.5m power cord,19999.0,19999.0
379,Baseus Speed Mini Quick Charger 1C 20W,2999.0,2999.0
380,Baseus GaN3 Pro Fast Charger 2C+U 65W Cloud Blue with C to C 100W Cable 1m Blue,10999.0,10999.0
381,Baseus GaN5 Pro 65W 2Type-C+1USB Fast Charger with C to C 100W 1M Cable,10199.0,10199.0
382,Baseus Super Si Quick Charger 1C 20W CN Blue ( With Type C to Lightning Cable),4499.0,4499.0
383,Baseus Compact 30W Quick Charger 2U+C CN,5499.0,5499.0
384,Baseus Bipow 20W 30000mAh Digital Display Power Bank,11599.0,11599.0
385,Baseus Bipow 15W 10000mAh Digital Display Power Bank,5499.0,5499.0
386,Baseus Qpow Pro Digital Display 10000mAh 20W Fast Charge Power Bank,8999.0,8999.0
387,Baseus Magnetic Mini Wireless 20000mAh 20W Fast Charge Power Bank,16499.0,16499.0
388,Baseus GaN3 Lite Fast Charger 67W Type C + USB,8499.0,8499.0
389,KOSPET TANK M2 Smartwatch,16500.0,19500.0
390,PlayStation VR2,199999.0,240000.0
391,Xiaomi Watch S1,39999.0,39999.0
392,LENOVO MONSTER AIRMARS XKT09,6799.0,6799.0
393,Haino Teko Game Buds 2,5999.0,5999.0
394,Baseus Yiven M30 3.5mm Jack Audio Aux Cable,1299.0,1299.0
395,Baseus Adaman Metal Digital Display Quick Charge Power Bank 20000mAh 65W,17599.0,17599.0
396,Apple Airpods 3,49999.0,49999.0
397,Xtrike Me RGB Backlight Mousepad MP-602,1990.0,1990.0
398,OTT TV Box 4k Ultra HD,2999.0,2999.0
